{
  "$schema": "http://json-schema.org/draft-07/schema#",
  "$id": "model-governance-adversarial.schema.json",
  "title": "Model Governance Adversarial Fixture Contract",
  "description": "Machine-checkable contract for LLM-08 (PR-A Lane A3): synthetic adversarial fixture documents for prompt/system/secret/rubric/tool/hidden-instruction/malformed-output cases. Every fixture embeds an obvious SENTINEL_ token (no real secrets), carries a SHA-256 digest manifest, and records an expected deterministic classification (failure for instruction-injection attempts, quarantine for malformed/leaked outputs). This contract validates structure only; the harness runs the real exported prompt constructors from app/api/src/lib/prompts.ts and the strict pure output validator, which the production runtime does not yet call (LLM-08 is foundation/partial, not production hardening). All policy states in this file are repository-only: proposed, PROPOSED, PENDING, OWNER_VERIFY, NOT_EVALUATED.",
  "type": "object",
  "required": ["schema", "schemaVersion", "status", "manifest", "fixtures"],
  "additionalProperties": false,
  "properties": {
    "schema": { "const": "model-governance-adversarial.schema.json" },
    "schemaVersion": { "const": 1 },
    "status": { "const": "proposed" },
    "description": { "type": "string", "minLength": 1 },
    "manifest": {
      "type": "object",
      "required": ["algorithm", "digests"],
      "additionalProperties": false,
      "properties": {
        "algorithm": { "const": "sha256" },
        "digests": {
          "type": "object",
          "additionalProperties": {
            "type": "string",
            "pattern": "^[0-9a-f]{64}$"
          }
        }
      }
    },
    "fixtures": {
      "type": "array",
      "minItems": 1,
      "items": {
        "type": "object",
        "required": ["id", "category", "promptKind", "payload", "sentinel", "expected", "provenance"],
        "additionalProperties": false,
        "properties": {
          "id": { "type": "string", "pattern": "^[a-z0-9][a-z0-9-]{0,99}$" },
          "category": {
            "enum": [
              "system_prompt_extraction",
              "secret_extraction",
              "rubric_override",
              "tool_invocation",
              "hidden_instructions",
              "malformed_output"
            ]
          },
          "promptKind": { "enum": ["conversation", "assessment"] },
          "payload": { "type": "string", "minLength": 1 },
          "sentinel": { "type": "string", "pattern": "^SENTINEL_[A-Z0-9_]{4,64}$" },
          "outputPayload": { "type": "string", "minLength": 1 },
          "expected": {
            "type": "object",
            "required": ["classification", "outputRejected"],
            "additionalProperties": false,
            "properties": {
              "classification": { "enum": ["failure", "quarantine"] },
              "outputRejected": { "type": "boolean" }
            }
          },
          "provenance": {
            "description": "LLM-06 provenance shape, validated by the real validateProvenance() import in app/api/src/model-governance/adversarial.ts.",
            "type": "object",
            "required": ["schema_version", "provider", "requestedModel", "workload", "prompt_template_version", "timestamp"],
            "additionalProperties": false,
            "properties": {
              "schema_version": { "const": 1 },
              "provider": { "enum": ["anthropic"] },
              "requestedModel": { "type": "string", "minLength": 1, "maxLength": 200 },
              "workload": { "enum": ["screening", "scoring"] },
              "prompt_template_version": { "type": "string", "minLength": 1, "maxLength": 100 },
              "timestamp": { "type": "string", "pattern": "^\\d{4}-\\d{2}-\\d{2}T\\d{2}:\\d{2}:\\d{2}(\\.\\d{1,3})?Z$" }
            }
          }
        }
      }
    }
  }
}
